10;ASRock A320M Pro4-F AM4;2510,00
10;ASRock B450M PRO4 AM4;325,00
10;ASRock B550 EXTREME4 AM4;8810,00
10;ASRock B550 PHANTOM GAMING 4 AM4;485,00
10;ASRock B550 PHANTOM GAMING 4/AC AM4;515,00
10;ASRock B550 STEEL LEGEND AM4;875,00
10;ASRock B550M PRO4 AM4;4410,00
10;ASRock B550M STEEL LEGEND AM4;635,00
10;ASRock B550M-HDV AM4;335,00
10;ASRock X570 PRO4 AM4;7510,00
10;Asus PRIME B550M-A (WI-FI) AM4;4105,00
10;Asus PRIME B550M-A AM4;4310,00
10;Asus PRIME B550M-K AM4;4110,00
10;Asus ROG STRIX B550-A GAMING AM4;7110,00
10;Asus ROG STRIX B550-E GAMING AM4;610,00
10;Asus ROG STRIX B550-I GAMING AM4;10110,00
10;ASUS ROG STRIX TRX40-XE GAMING sTRX4;261010,00
10;Asus TUF GAMING B550-PLUS (WI-FI) AM4;1101010,00
10;Asus TUF GAMING B550-PLUS AM4;675,00
10;Asus TUF GAMING B550M-PLUS (WI-FI) AM4;5610,00
10;Asus TUF GAMING B550M-PLUS AM4;51010,00
10;ASUS TUF GAMING X570-PLUS (WI-FI) s.AM4;5410,00
10;ASUS TUF GAMING X570-PLUS AM4;010,00
10;ASUS TUF GAMING X570-PRO (WI-FI) s.AM4;10410,00
10;Gigabyte A520M AORUS ELITE AM4;11410,00
10;Gigabyte A520M S2H AM4;345,00
10;Gigabyte B450M DS3H V2 AM4;2710,00
10;Gigabyte B550 AORUS ELITE AX V2 AM4;21010,00
10;Gigabyte B550 AORUS ELITE V2 AM4;8010,00
10;Gigabyte B550 AORUS MASTER AM4;605,00
10;Gigabyte B550 AORUS PRO AC AM4;1175,00
10;Gigabyte B550 AORUS PRO V2 AM4;825,00
10;Gigabyte B550 GAMING X AM4;8010,00
10;Gigabyte B550 GAMING X V2 AM4;4110,00
10;Gigabyte B550M DS3H AM4;4610,00
10;Gigabyte B550M S2H AM4;415,00
10;Gigabyte X570 AORUS ELITE AM4;355,00
10;Gigabyte X570 AORUS MASTER AM4;10410,00
10;Gigabyte X570 AORUS PRO AM4;151010,00
10;Gigabyte X570 AORUS ULTRA AM4;11610,00
10;Gigabyte X570 GAMING X AM4;14110,00
10;Gigabyte X570 I AORUS PRO WIFI AM4;725,00
10;Gigabyte X570 UD AM4;101010,00
10;MSI B450 TOMAHAWK MAX AM4;6010,00
10;MSI A320M-A PRO M2 AM4;12410,00
10;MSI A520M PRO AM4;11410,00
10;MSI A520M-A PRO AM4;1375,00
10;MSI B450 GAMING PLUS MAX AM4;785,00
10;MSI B550-A PRO AM4;31010,00
10;MSI B550M PRO AM4;275,00
10;MSI B550M PRO-VDH AM4;2105,00
10;MSI B550M PRO-VDH WIFI AM4;225,00
10;MSI B550M-A PRO AM4;425,00
10;MSI MAG B550 TOMAHAWK AM4;51010,00
10;MSI MAG B550 TORPEDO AM4;4110,00
10;MSI MAG B550M BAZOOKA AM4;475,00
10;MSI MAG B550M MORTAR AM4;5410,00
10;MSI MAG B550M MORTAR WIFI AM4;385,00
10;MSI MAG X570 TOMAHAWK WIFI AM4;745,00
10;MSI MEG X570 ACE AM4;7310,00
10;MSI MEG X570 GODLIKE AM4;5010,00
10;MSI MPG B550 GAMING EDGE WIFI AM4;5210,00
10;MSI MPG B550 GAMING PLUS AM4;6810,00
10;MSI MPG X570 GAMING EDGE WI-FI AM4;10510,00
10;MSI MPG X570 GAMING PLUS AM4;1265,00
10;MSI MPG X570 GAMING PRO CARBON WIFI AM4;1145,00
10;MSI TRX40 PRO WIFI sTRX4;151010,00
10;MSI X570-A PRO AM4;321010,00
10;ASRock H4M-HDV/M.2 DDR4 LGA1200;765,00
10;ASRock Z5100 EXTREME DDR4 LGA1200;71010,00
10;Gigabyte B460M DS3H V2 DDR4 LGA1200;10110,00
10;Gigabyte B560M AORUS ELITE DDR4 LGA1200;7110,00
10;Gigabyte H5M H DDR4 LGA1200;1155,00
10;Gigabyte H5M S2 DDR4 LGA1200;1365,00
10;Gigabyte H5M S2H DDR4 LGA1200;21410,00
10;Gigabyte Z5100 AORUS ELITE AX DDR4 LGA1200;10410,00
10;Gigabyte Z5100 AORUS MASTER DDR4 LGA1200;475,00
10;Gigabyte Z5100 AORUS PRO AX DDR4 LGA1200;6610,00
10;Gigabyte Z5100 GAMING X DDR4 LGA1200;3310,00
10;Gigabyte Z5100 UD AC DDR4 LGA1200;71010,00
10;Gigabyte Z5100 VISION G DDR4 LGA1200;6610,00
10;MSI B560M PRO DDR4 LGA1200;665,00
10;MSI B560M PRO-VDH WIFI DDR4 LGA1200;565,00
10;MSI H4M PRO DDR4 LGA1200;1025,00
10;MSI H4M-A PRO DDR4 LGA1200;18410,00
10;MSI H5M PRO DDR4 LGA1200;7410,00
10;MSI H5M-A PRO DDR4 LGA1200;8410,00
10;MSI MAG B560 TOMAHAWK WIFI DDR4 LGA1200;151010,00
10;MSI MAG B560 TORPEDO DDR4 LGA1200;3610,00
10;MSI MAG B560M BAZOOKA DDR4 LGA1200;5310,00
10;MSI MAG Z5100 TORPEDO DDR4 LGA1200;415,00
10;MSI MEG Z5100 ACE GOLD EDITION DDR4 LGA1200;3610,00
10;MSI MPG Z5100 GAMING PLUS DDR4 LGA1200;810,00
10;MSI Z5100-A PRO DDR4 LGA1200;715,00